{
  "type": "cursor-cli",
  "name": "Cursor CLI",
  "category": "cli",
  "aliases": [
    "cursor"
  ],
  "icon": "🤖",
  "displayName": "Cursor CLI",
  "binary": "agent",
  "spawn": {
    "command": "agent",
    "args": [],
    "shell": true,
    "env": {}
  },
  "compatibility": [
    {
      "ideVersion": ">=1.0.0",
      "scriptDir": "scripts/1.0"
    }
  ],
  "status": "Beta",
  "details": "Terminal only",
  "providerVersion": "1.0.0",
  "contractVersion": 2
}
