{
  "type": "github-copilot-cli",
  "name": "GitHub Copilot CLI",
  "category": "cli",
  "aliases": [
    "gh-copilot"
  ],
  "icon": "🤖",
  "displayName": "GitHub Copilot CLI",
  "binary": "gh",
  "spawn": {
    "command": "gh",
    "args": [
      "copilot"
    ],
    "shell": true,
    "env": {}
  },
  "compatibility": [
    {
      "ideVersion": ">=1.0.0",
      "scriptDir": "scripts/1.0"
    }
  ],
  "defaultScriptDir": "scripts/1.0",
  "approvalKeys": {
    "0": "1",
    "1": "2",
    "2": "3"
  },
  "status": "Beta",
  "details": "Terminal only"
}
