{
  "type": "goose-cli",
  "name": "Goose",
  "category": "cli",
  "aliases": [
    "goose"
  ],
  "icon": "🤖",
  "displayName": "Goose",
  "binary": "goose",
  "spawn": {
    "command": "goose",
    "args": [],
    "shell": true,
    "env": {}
  },
  "compatibility": [
    {
      "ideVersion": ">=1.0.0",
      "scriptDir": "scripts/1.0"
    }
  ],
  "defaultScriptDir": "scripts/1.0",
  "approvalKeys": {
    "0": "\r",
    "1": "\u001b[C\r"
  },
  "resume": {
    "supported": true,
    "stopStrategy": "command",
    "stopCommand": "exit",
    "shutdownGraceMs": 4000,
    "sessionIdFormat": "string",
    "resumeSessionArgs": [
      "session",
      "--resume",
      "--session-id",
      "{{id}}"
    ],
    "resumeArgs": [
      "session",
      "--resume"
    ]
  },
  "status": "Beta",
  "details": "Terminal only",
  "providerVersion": "1.0.0",
  "contractVersion": 2
}
