{
  "type": "opencode-cli",
  "name": "OpenCode CLI",
  "category": "cli",
  "aliases": [
    "opencode"
  ],
  "icon": "🤖",
  "displayName": "OpenCode CLI",
  "binary": "opencode",
  "spawn": {
    "command": "opencode",
    "args": [],
    "shell": true,
    "env": {}
  },
  "compatibility": [
    {
      "ideVersion": ">=1.0.0",
      "scriptDir": "scripts/1.0"
    }
  ],
  "status": "Beta",
  "details": "Terminal only"
}
